{
  "$schema": "http://json-schema.org/draft-07/schema#",
  "title": "Observed behavior candidate input (not normative authority)",
  "type": "object",
  "additionalProperties": false,
  "required": [
    "formatVersion",
    "baselineId",
    "scope",
    "observations"
  ],
  "properties": {
    "formatVersion": {
      "const": 1
    },
    "baselineId": {
      "type": "string",
      "pattern": "^[a-z][a-z0-9-]*$"
    },
    "scope": {
      "type": "array",
      "minItems": 1,
      "uniqueItems": true,
      "items": {
        "type": "string",
        "pattern": "^(?!/)(?!.*(?:^|/)\\.\\.(?:/|$))(?!.*\\\\).+$"
      }
    },
    "observations": {
      "type": "array",
      "minItems": 1,
      "items": {
        "type": "object",
        "required": [
          "key",
          "kind",
          "claim",
          "confidence",
          "evidenceRefs",
          "authorityRefs",
          "conflictRefs",
          "disposition",
          "rationale"
        ],
        "additionalProperties": false,
        "properties": {
          "key": {
            "type": "string",
            "pattern": "^[a-z][a-z0-9-]*$"
          },
          "kind": {
            "enum": [
              "direct",
              "inference"
            ]
          },
          "claim": {
            "type": "string",
            "minLength": 1
          },
          "confidence": {
            "type": "number",
            "minimum": 0,
            "maximum": 1
          },
          "evidenceRefs": {
            "type": "array",
            "minItems": 1,
            "items": {
              "type": "object",
              "required": [
                "path",
                "start",
                "end"
              ],
              "additionalProperties": false,
              "properties": {
                "path": {
                  "type": "string",
                  "pattern": "^(?!/)(?!.*(?:^|/)\\.\\.(?:/|$))(?!.*\\\\).+$"
                },
                "start": {
                  "type": "integer",
                  "minimum": 1
                },
                "end": {
                  "type": "integer",
                  "minimum": 1
                }
              }
            }
          },
          "authorityRefs": {
            "type": "array",
            "items": {
              "type": "object",
              "required": [
                "path",
                "start",
                "end"
              ],
              "additionalProperties": false,
              "properties": {
                "path": {
                  "type": "string",
                  "pattern": "^(?!/)(?!.*(?:^|/)\\.\\.(?:/|$))(?!.*\\\\).+$"
                },
                "start": {
                  "type": "integer",
                  "minimum": 1
                },
                "end": {
                  "type": "integer",
                  "minimum": 1
                }
              }
            }
          },
          "conflictRefs": {
            "type": "array",
            "items": {
              "type": "object",
              "required": [
                "path",
                "start",
                "end"
              ],
              "additionalProperties": false,
              "properties": {
                "path": {
                  "type": "string",
                  "pattern": "^(?!/)(?!.*(?:^|/)\\.\\.(?:/|$))(?!.*\\\\).+$"
                },
                "start": {
                  "type": "integer",
                  "minimum": 1
                },
                "end": {
                  "type": "integer",
                  "minimum": 1
                }
              }
            }
          },
          "disposition": {
            "enum": [
              "aligned",
              "drift",
              "ambiguous",
              "unrequested",
              "authority-missing"
            ]
          },
          "rationale": {
            "type": "string",
            "minLength": 1
          }
        }
      }
    }
  }
}
